title,category,price,availability_text,availability_n,rating,description,upc,product_url,image_url,in_stock,desc_word_count
In the Woods (Dublin Murder Squad #1),Mystery,38.38,In stock (6 available),6,2,"A gorgeously written novel that marks the debut of an astonishing new voice in psychological suspense.As dusk approaches a small Dublin suburb in the summer of 1984, mothers begin to call their children home. But on this warm evening, three children do not return from the dark and silent woods. When the police arrive, they find only one of the children. He is gripping a tr A gorgeously written novel that marks the debut of an astonishing new voice in psychological suspense.As dusk approaches a small Dublin suburb in the summer of 1984, mothers begin to call their children home. But on this warm evening, three children do not return from the dark and silent woods. When the police arrive, they find only one of the children. He is gripping a tree trunk in terror, wearing blood-filled sneakers and unable to recall a single detail of the previous hours.Twenty years later, the found boy, Rob Ryan, is a detective on the Dublin Murder Squad and keeps his past a secret. But when a 12-year-old girl is found murdered in the same woods, he and Detective Cassie Maddox (his partner and closest friend) find themselves investigating a case chillingly similar to the previous unsolved mystery. Now, with only snippets of long-buried memories to guide him, Ryan has the chance to uncover both the mystery of the case before him and that of his own shadowy past. ...more",6958de044cb28a84,https://books.toscrape.com/catalogue/in-the-woods-dublin-murder-squad-1_433/index.html,https://books.toscrape.com/media/cache/13/47/13470484ded8c835ce03b662fc863a1a.jpg,True,236
The Silkworm (Cormoran Strike #2),Mystery,23.05,In stock (3 available),3,5,"Private investigator Cormoran Strike returns in a new mystery from Robert Galbraith, author of the #1 international bestseller The Cuckoo's Calling.When novelist Owen Quine goes missing, his wife calls in private detective Cormoran Strike. At first, Mrs. Quine just thinks her husband has gone off by himself for a few days—as he has done before—and she wants Strike to find Private investigator Cormoran Strike returns in a new mystery from Robert Galbraith, author of the #1 international bestseller The Cuckoo's Calling.When novelist Owen Quine goes missing, his wife calls in private detective Cormoran Strike. At first, Mrs. Quine just thinks her husband has gone off by himself for a few days—as he has done before—and she wants Strike to find him and bring him home.But as Strike investigates, it becomes clear that there is more to Quine's disappearance than his wife realizes. The novelist has just completed a manuscript featuring poisonous pen-portraits of almost everyone he knows. If the novel were to be published, it would ruin lives—meaning that there are a lot of people who might want him silenced.When Quine is found brutally murdered under bizarre circumstances, it becomes a race against time to understand the motivation of a ruthless killer, a killer unlike any Strike has encountered before... ...more",f06039c29b5891fa,https://books.toscrape.com/catalogue/the-silkworm-cormoran-strike-2_280/index.html,https://books.toscrape.com/media/cache/fa/d2/fad227281b25d606782218a33323991b.jpg,True,211
The Exiled,Mystery,43.45,In stock (3 available),3,3,"Can anyone ever truly outrun his past?Back in the 1980s, Wes Raney was an ambitious New York City Narcotics Detective with a growing drug habit of his own. While working undercover on a high-risk case, he made decisions that ultimately cost him not only his career, but also his family. Disgraced, Raney fled-but history is finally catching up with him.Now in his early forti Can anyone ever truly outrun his past?Back in the 1980s, Wes Raney was an ambitious New York City Narcotics Detective with a growing drug habit of his own. While working undercover on a high-risk case, he made decisions that ultimately cost him not only his career, but also his family. Disgraced, Raney fled-but history is finally catching up with him.Now in his early forties, Raney has been living in exile, the sole homicide investigator covering a two-hundred-mile stretch of desert in New Mexico. His solitude is his salvation-but it ends when a brutal drug deal gone wrong results in a triple murder. Staged in a locked underground bunker, the crime reawakens Raney's haunted and violent past.From the vast, unforgiving landscape of the American west to the mean streets of New York, The Exiled is at once a riveting murder mystery and a brilliant portrait of a man on the run from himself, an unforgettable thriller that is ""impossible to put down"" (Frank Bill). ...more",dd003e904727281a,https://books.toscrape.com/catalogue/the-exiled_247/index.html,https://books.toscrape.com/media/cache/dd/29/dd29147b962e4480491cac5bce41e4e4.jpg,True,228
The Cuckoo's Calling (Cormoran Strike #1),Mystery,19.21,In stock (3 available),3,1,"A BRILLIANT DEBUT MYSTERY IN A CLASSIC VEIN: DETECTIVE CORMORAN STRIKE INVESTIGATES A SUPERMODEL'S SUICIDE. After losing his leg to a land mine in Afghanistan, Cormoran Strike is barely scraping by as a private investigator. Strike is down to one client, and creditors are calling. He has also just broken up with his longtime girlfriend and is living in his office.Then John A BRILLIANT DEBUT MYSTERY IN A CLASSIC VEIN: DETECTIVE CORMORAN STRIKE INVESTIGATES A SUPERMODEL'S SUICIDE. After losing his leg to a land mine in Afghanistan, Cormoran Strike is barely scraping by as a private investigator. Strike is down to one client, and creditors are calling. He has also just broken up with his longtime girlfriend and is living in his office.Then John Bristow walks through his door with an amazing story: His sister, the legendary supermodel Lula Landry, known to her friends as the Cuckoo, famously fell to her death a few months earlier. The police ruled it a suicide, but John refuses to believe that. The case plunges Strike into the world of multimillionaire beauties, rock-star boyfriends, and desperate designers, and it introduces him to every variety of pleasure, enticement, seduction, and delusion known to man.You may think you know detectives, but you've never met one quite like Strike. You may think you know about the wealthy and famous, but you've never seen them under an investigation like this. Introducing Cormoran Strike, this is the acclaimed first crime novel by J.K. Rowling, writing under the pseudonym Robert Galbraith. ...more",1be6d3b121865edb,https://books.toscrape.com/catalogue/the-cuckoos-calling-cormoran-strike-1_239/index.html,https://books.toscrape.com/media/cache/72/ec/72ec24f082aba608ca37bc3aeaf57317.jpg,True,252
Extreme Prey (Lucas Davenport #26),Mystery,25.4,In stock (3 available),3,3,"The extraordinary new Lucas Davenport thriller from #1New York Times–bestselling author and Pulitzer Prize winner John Sandford. After the events in Gathering Prey, Lucas Davenport finds himself in a very unusual situation—no longer employed by the Minnesota BCA. His friend the governor is just cranking up a presidential campaign, though, and he invites Lucas to come alon The extraordinary new Lucas Davenport thriller from #1 New York Times–bestselling author and Pulitzer Prize winner John Sandford.   After the events in Gathering Prey, Lucas Davenport finds himself in a very unusual situation—no longer employed by the Minnesota BCA. His friend the governor is just cranking up a presidential campaign, though, and he invites Lucas to come along as part of his campaign staff. “Should be fun!” he says, and it kind of is—until they find they have a shadow: an armed man intent on killing the governor . . . and anyone who gets in the way. ...more",588ba85ff11a3263,https://books.toscrape.com/catalogue/extreme-prey-lucas-davenport-26_154/index.html,https://books.toscrape.com/media/cache/0a/b2/0ab24d35793497f6a72137191b91659e.jpg,True,157
Career of Evil (Cormoran Strike #3),Mystery,24.72,In stock (3 available),3,2,"Cormoran Strike is back, with his assistant Robin Ellacott, in a mystery based around soldiers returning from war.When a mysterious package is delivered to Robin Ellacott, she is horrified to discover that it contains a woman’s severed leg.Her boss, private detective Cormoran Strike, is less surprised but no less alarmed. There are four people from his past who he thinks c Cormoran Strike is back, with his assistant Robin Ellacott, in a mystery based around soldiers returning from war.When a mysterious package is delivered to Robin Ellacott, she is horrified to discover that it contains a woman’s severed leg.Her boss, private detective Cormoran Strike, is less surprised but no less alarmed. There are four people from his past who he thinks could be responsible – and Strike knows that any one of them is capable of sustained and unspeakable brutality.With the police focusing on the one suspect Strike is increasingly sure is not the perpetrator, he and Robin take matters into their own hands, and delve into the dark and twisted worlds of the other three men. But as more horrendous acts occur, time is running out for the two of them…Career of Evil is the third in the series featuring private detective Cormoran Strike and his assistant Robin Ellacott. A mystery and also a story of a man and a woman at a crossroads in their personal and professional lives. ...more",b461cf238506c5b8,https://books.toscrape.com/catalogue/career-of-evil-cormoran-strike-3_137/index.html,https://books.toscrape.com/media/cache/40/f8/40f897ffbfda6e88e5763c157cfd0930.jpg,True,232
The No. 1 Ladies' Detective Agency (No. 1 Ladies' Detective Agency #1),Mystery,57.7,In stock (1 available),1,4,"The No.1 ladies' detective agency consists of one woman, the engaging and sassy Precious Ramotswe, who sets up shop in Gabarone, Botswana. This unlikely herione specialises in missing husbands, wayward daughters, con men and impostors.",b0913e67d38d5ed5,https://books.toscrape.com/catalogue/the-no-1-ladies-detective-agency-no-1-ladies-detective-agency-1_76/index.html,https://books.toscrape.com/media/cache/62/8c/628c0151226402726149c98549671250.jpg,True,35
The Girl You Lost,Mystery,12.29,In stock (1 available),1,5,"Eighteen years ago your baby daughter was snatched. Today, she came back. A sinister and darkly compelling psychological thriller from the No.1 bestselling author of The Girl With No Past. Eighteen years ago, Simone Porter’s six-month-old daughter, Helena, was abducted. Simone and husband, Matt, have slowly rebuilt their shattered lives, but the pain at losing their child Eighteen years ago your baby daughter was snatched. Today, she came back. A sinister and darkly compelling psychological thriller from the No.1 bestselling author of The Girl With No Past. Eighteen years ago, Simone Porter’s six-month-old daughter, Helena, was abducted. Simone and husband, Matt, have slowly rebuilt their shattered lives, but the pain at losing their child has never left them. Then a young woman, Grace, appears out of the blue and tells Simone she has information about her stolen baby. But just who is Grace – and can Simone trust her? When Grace herself disappears, Simone becomes embroiled in a desperate search for her daughter and the woman who has vital clues about her whereabouts. Simone is inching closer to the truth but it’ll take her into dangerous and disturbing territory. Simone lost her baby. Will she lose her life trying to find her? Read what people are saying about the Number One Bestseller, The Girl With No Past: ‘I read this in a day and found myself totally engaged with the plot. Kathryn Croft has pulled off a very accessible mystery, that exceeded my expectations and shows her talent. The ending was just right! Worth a read if you fancy a well paced mystery, on these dark autumnal nights.’ Northern Crime ‘Kept the tension and mystery going right until the end … An intense read that keeps you turning page after page.’ Crime Book Club ‘Wow! This book grabbed me from the very beginning! … To say this book is a page turner would be an understatement!’ Chat About Books ‘It kept me up all night and cost me my beauty sleep! I will get it out of the way immediately and tell you that this is one of the best thrillers I have read this year and it is fully deserving of my 5-star rating.’ Books Are Man’s Other Best Friend ‘BLIMEY. This book is GRIPPY - I sat and read it over the course of a day and a night, purely because I couldn't put it down.’ Reading Room with a View ‘The reader is kept guessing until the end. It's perfection for a thriller and the author does amazingly to keep our intrigue.’ Chic Toronto ‘Gripping, a real page turner… Excellent plot, and gripping stuff, that keeps the reader guessing until the end … raced to the end to find out what was happening and how it would all end … what a storyteller Kathryn Croft is!’ Emma’s Book Reviews ‘The concept of this book, and the story itself is phenomenal - honestly one of the best i have read, it really does outshine all other thrillers i have read.’ Afternoon Bookery ‘I really enjoyed this from start to finish. It's one of these books where you just HAVE to read JUST a couple more pages to see what is going to happen next. The author is very good at building suspense and revealing details bit by bit. It was totally unpredictable and had some very good twists. ...more",4280ac3eab57aa5d,https://books.toscrape.com/catalogue/the-girl-you-lost_66/index.html,https://books.toscrape.com/media/cache/28/15/2815974db428ea019fc84e08af23095b.jpg,True,561
The Girl In The Ice (DCI Erika Foster #1),Mystery,15.85,In stock (1 available),1,3,"Her eyes are wide open. Her lips parted as if to speak. Her dead body frozen in the ice…She is not the only one. When a young boy discovers the body of a woman beneath a thick sheet of ice in a South London park, Detective Erika Foster is called in to lead the murder investigation. The victim, a beautiful young socialite, appeared to have the perfect life. Yet when Erika b Her eyes are wide open. Her lips parted as if to speak. Her dead body frozen in the ice…She is not the only one. When a young boy discovers the body of a woman beneath a thick sheet of ice in a South London park, Detective Erika Foster is called in to lead the murder investigation. The victim, a beautiful young socialite, appeared to have the perfect life. Yet when Erika begins to dig deeper, she starts to connect the dots between the murder and the killings of three prostitutes, all found strangled, hands bound and dumped in water around London. What dark secrets is the girl in the ice hiding? As Erika inches closer to uncovering the truth, the killer is closing in on Erika. The last investigation Erika led went badly wrong… resulting in the death of her husband. With her career hanging by a thread, Erika must now battle her own personal demons as well as a killer more deadly than any she’s faced before. But will she get to him before he strikes again?A page-turning thriller packed with suspense. If you like Angela Marsons, Rachel Abbott and Karin Slaughter, discover Rob Bryndza’s new series today – at a special launch price. Watch out for more from DCI Erika FosterShe’s fearless. Respected. Unstoppable. Detective Erika Foster will catch a killer, whatever it takes. 1. THE GIRL IN THE ICE 2. THE NIGHT STALKER (COMING SOON) ...more",ee61197edb882599,https://books.toscrape.com/catalogue/the-girl-in-the-ice-dci-erika-foster-1_65/index.html,https://books.toscrape.com/media/cache/83/54/835421d17d99c89fd99d07e17806357b.jpg,True,311
Blood Defense (Samantha Brinkman #1),Mystery,20.3,In stock (1 available),1,3,"First in a new series from bestselling author and famed O. J. Simpson trial prosecutor Marcia Clark, a “terrific writer and storyteller” (James Patterson). Samantha Brinkman, an ambitious, hard-charging Los Angeles criminal defense attorney, is struggling to make a name for herself and to drag her fledgling practice into the big leagues. Sam lands a high-profile double-mu First in a new series from bestselling author and famed O. J. Simpson trial prosecutor Marcia Clark, a “terrific writer and storyteller” (James Patterson). Samantha Brinkman, an ambitious, hard-charging Los Angeles criminal defense attorney, is struggling to make a name for herself and to drag her fledgling practice into the big leagues. Sam lands a high-profile double-murder case in which one of the victims is a beloved TV star—and the defendant is a decorated veteran LAPD detective. It promises to be exactly the kind of media sensation that would establish her as a heavy hitter in the world of criminal law.Though Sam has doubts about his innocence, she and her two associates (her closest childhood friend and a brilliant ex-con) take the case. Notorious for living by her own rules—and fearlessly breaking everyone else’s—Samantha pulls out all the stops in her quest to uncover evidence that will clear the detective. But when a shocking secret at the core of the case shatters her personal world, Sam realizes that not only has her client been playing her, he might be one of the most dangerous sociopaths she’s ever encountered. ...more",95cdfd514098c38b,https://books.toscrape.com/catalogue/blood-defense-samantha-brinkman-1_8/index.html,https://books.toscrape.com/media/cache/ea/12/ea12c82131832c5d772fdbd3cb56ced7.jpg,True,246
1st to Die (Women's Murder Club #1),Mystery,53.98,In stock (1 available),1,1,"James Patterson, bestselling author of the Alex Cross novels Along Came a Spider, Kiss the Girls, and Pop Goes the Weasel, offers the first of a new series dubbed The Women's Murder Club, featuring a four-woman team that occasionally works outside the system. None of the gritty darkness or frenzied action is lost in 1st to Die, although the female protagonists offer an eve James Patterson, bestselling author of the Alex Cross novels Along Came a Spider, Kiss the Girls, and Pop Goes the Weasel, offers the first of a new series dubbed The Women's Murder Club, featuring a four-woman team that occasionally works outside the system. None of the gritty darkness or frenzied action is lost in 1st to Die, although the female protagonists offer an even deeper emotional context to this suspense thriller.Inspector Lindsay Boxer of the San Francisco Police Department suddenly finds herself in the middle of two horrifying situations: The first is that she's just learned she has an often-fatal blood disease. The second is a double homicide case she is now heading up that involves the murder of newlyweds on their wedding night. Burdened with Chris Raleigh, a new partner reassigned from the mayor's office, Lindsay finds that she has too much to deal with and turns to her best friend, Claire, the head ME on the case. Claire offers helpful advice and human, friendly contact amid a job filled with violence, cruelty, and fear.Soon a fledgling newspaper reporter, Cindy, makes contact with Lindsay looking for a career-making story. Although Lindsay can't officially comment on the case, the two women form a rapport, and Cindy joins Lindsay and Claire for their weekly meeting. When a second pair of newlyweds is murdered, and later a third, the investigation leads to a prominent crime writer, Nicholas Jenks, who has a history of spousal abuse and a predilection for kinky, dangerous sex games. With the help of an understanding assistant D.A., Jill Bernhardt, Lindsay tries to make a case against Jenks, who even had an affair with one of the slain women. Eventually Jill joins the Murder Club, and the four ladies share private interdepartmental information in an effort to track and stop the killer before he strikes again.The major subplot -- Lindsay's facing up to her illness even while she learns to fall in love again -- carefully compensates for the novel's coarse scenes of brutality. Lindsay Boxer is't merely an obsessed cop trailing a maniac; she's also a terrified woman confronting the onslaught of disease. The story lines balance out to show us the true mettle of someone who puts the safety of others before her own.Again, Patterson's skill for producing furiously paced fiction are evident as the novel breezes by rapidly. The short chapters keep the narrative leaping with increasingly taut plot elements, but there's an emotional commitment that makes our protagonist even more amiable and involving. 1st to Die is a novel that works as an intense series of character portraits that will leave the reader touched and delighted.--Tom Piccirilli ...more",f684a82adc49f011,https://books.toscrape.com/catalogue/1st-to-die-womens-murder-club-1_2/index.html,https://books.toscrape.com/media/cache/f6/8e/f68e6ae2f9da04fccbde8442b0a1b52a.jpg,True,507
Tipping the Velvet,Historical Fiction,53.74,In stock (20 available),20,1,"""Erotic and absorbing...Written with starling power.""--""The New York Times Book Review "" Nan King, an oyster girl, is captivated by the music hall phenomenon Kitty Butler, a male impersonator extraordinaire treading the boards in Canterbury. Through a friend at the box office, Nan manages to visit all her shows and finally meet her heroine. Soon after, she becomes Kitty's ""Erotic and absorbing...Written with starling power.""--""The New York Times Book Review "" Nan King, an oyster girl, is captivated by the music hall phenomenon Kitty Butler, a male impersonator extraordinaire treading the boards in Canterbury. Through a friend at the box office, Nan manages to visit all her shows and finally meet her heroine. Soon after, she becomes Kitty's dresser and the two head for the bright lights of Leicester Square where they begin a glittering career as music-hall stars in an all-singing and dancing double act. At the same time, behind closed doors, they admit their attraction to each other and their affair begins. ...more",90fa61229261140a,https://books.toscrape.com/catalogue/tipping-the-velvet_999/index.html,https://books.toscrape.com/media/cache/08/e9/08e94f3731d7d6b760dfbfbc02ca5c62.jpg,True,165
Forever and Forever: The Courtship of Henry Longfellow and Fanny Appleton,Historical Fiction,29.69,In stock (16 available),16,3,"A Proper Historical Romance seriesThe first book in a new series which will focus on the lives of real historical figures who have intriguing stories of courtship that are recreated in fictionalized accounts based on real biographical and social history research.""A well-researched, emotionally charged tale. A love story...fit for the ages."" -Publishers Weekly.It's 1836, an A Proper Historical Romance seriesThe first book in a new series which will focus on the lives of real historical figures who have intriguing stories of courtship that are recreated in fictionalized accounts based on real biographical and social history research.""A well-researched, emotionally charged tale. A love story...fit for the ages."" -Publishers Weekly.It's 1836, and nineteen-year-old Fanny Appleton, a privileged daughter of a wealthy, upper-class Boston industrialist, is touring Europe with her family. Like many girls of her day, she enjoys the fine clothes, food, and company of the elite social circles. But unlike her peers, Fanny is also drawn to education, literature, and more intellectual pursuits.Published author and poet Henry Wadsworth Longfellow is also touring Europe, but under much different circumstances. Widowed while on tour, he has stayed in order to gather credentials that he hopes will secure his professorship at Harvard College. When Henry meets Fanny, he sees in her a kindred spirit, a lover of language and literature and high ideals. He is in love. Fanny, however, is uncertain. He is ten years older than she is, and from a much lower social class. How could such a relationship ever thrive?Could a book of Henry’s poetry, personally delivered, persuade Fanny to believe in a love that lasts forever and forever? ...more",9beb96a2300109d7,https://books.toscrape.com/catalogue/forever-and-forever-the-courtship-of-henry-longfellow-and-fanny-appleton_894/index.html,https://books.toscrape.com/media/cache/f9/9e/f99e760b894d10c6e5ed578618918367.jpg,True,269
