title,category,price,availability_text,availability_n,rating,description,upc,product_url,image_url,in_stock,desc_word_count
Voyager (Outlander #3),Historical Fiction,21.07,In stock (3 available),3,5,"From the author of the breathtaking bestsellers Outlander and Dragonfly in Amber, the extraordinary saga continues.Their passionate encounter happened long ago by whatever measurement Claire Randall took. Two decades before, she had traveled back in time and into the arms of a gallant eighteenth-century Scot named Jamie Fraser. Then she returned to her own century to bear From the author of the breathtaking bestsellers Outlander and Dragonfly in Amber, the extraordinary saga continues.Their passionate encounter happened long ago by whatever measurement Claire Randall took. Two decades before, she had traveled back in time and into the arms of a gallant eighteenth-century Scot named Jamie Fraser. Then she returned to her own century to bear his child, believing him dead in the tragic battle of Culloden. Yet his memory has never lessened its hold on her... and her body still cries out for him in her dreams.Then Claire discovers that Jamie survived. Torn between returning to him and staying with their daughter in her own era, Claire must choose her destiny. And as time and space come full circle, she must find the courage to face the passion and pain awaiting her...the deadly intrigues raging in a divided Scotland... and the daring voyage into the dark unknown that can reunite or forever doom her timeless love. ...more",7feac4000cbc5859,https://books.toscrape.com/catalogue/voyager-outlander-3_299/index.html,https://books.toscrape.com/media/cache/6e/22/6e22497cbecedef59be86d1328e4b044.jpg,True,216
The Red Tent,Historical Fiction,35.66,In stock (3 available),3,5,"Her name is Dinah. In the Bible, her life is only hinted at in a brief and violent detour within the more familiar chapters of the Book of Genesis that are about her father, Jacob, and his dozen sons. Told in Dinah's voice, this novel reveals the traditions and turmoils of ancient womanhood--the world of the red tent. It begins with the story of her mothers--Leah, Rachel, Her name is Dinah. In the Bible, her life is only hinted at in a brief and violent detour within the more familiar chapters of the Book of Genesis that are about her father, Jacob, and his dozen sons. Told in Dinah's voice, this novel reveals the traditions and turmoils of ancient womanhood--the world of the red tent. It begins with the story of her mothers--Leah, Rachel, Zilpah, and Bilhah--the four wives of Jacob. They love Dinah and give her gifts that sustain her through a hard-working youth, a calling to midwifery, and a new home in a foreign land. Dinah's story reaches out from a remarkable period of early history and creates an intimate connection with the past. Deeply affecting, The Red Tent combines rich storytelling with a valuable achievement in modern fiction: a new view of biblical women's society. ...more",3c456328b04a8ee8,https://books.toscrape.com/catalogue/the-red-tent_273/index.html,https://books.toscrape.com/media/cache/15/59/155942710c3ae4bd4ed622df9a999b99.jpg,True,209
The Last Painting of Sara de Vos,Historical Fiction,55.55,In stock (3 available),3,2,"This is what we long for: the profound pleasure of being swept into vivid new worlds, worlds peopled by characters so intriguing and real that we can't shake them, even long after the reading's done. In his earlier, award-winning novels, Dominic Smith demonstrated a gift for coaxing the past to life. Now, in The Last Painting of Sara de Vos, he deftly bridges the historica This is what we long for: the profound pleasure of being swept into vivid new worlds, worlds peopled by characters so intriguing and real that we can't shake them, even long after the reading's done. In his earlier, award-winning novels, Dominic Smith demonstrated a gift for coaxing the past to life. Now, in The Last Painting of Sara de Vos, he deftly bridges the historical and the contemporary, tracking a collision course between a rare landscape by a female Dutch painter of the golden age, an inheritor of the work in 1950s Manhattan, and a celebrated art historian who painted a forgery of it in her youth.In 1631, Sara de Vos is admitted as a master painter to the Guild of St. Luke's in Holland, the first woman to be so recognized. Three hundred years later, only one work attributed to de Vos is known to remain--a haunting winter scene, At the Edge of a Wood, which hangs over the bed of a wealthy descendant of the original owner. An Australian grad student, Ellie Shipley, struggling to stay afloat in New York, agrees to paint a forgery of the landscape, a decision that will haunt her. Because now, half a century later, she's curating an exhibit of female Dutch painters, and both versions threaten to arrive. As the three threads intersect, The Last Painting of Sara de Vos mesmerizes while it grapples with the demands of the artistic life, showing how the deceits of the past can forge the present. ...more",476c7972e9b41891,https://books.toscrape.com/catalogue/the-last-painting-of-sara-de-vos_259/index.html,https://books.toscrape.com/media/cache/1c/e4/1ce4c2573d65ebdc3c85d9a6592d57b1.jpg,True,316
The Guernsey Literary and Potato Peel Pie Society,Historical Fiction,49.53,In stock (3 available),3,1,"“ I wonder how the book got to Guernsey? Perhaps there is some sort of secret homing instinct in books that brings them to their perfect readers.” January 1946: London is emerging from the shadow of the Second World War, and writer Juliet Ashton is looking for her next book subject. Who could imagine that she would find it in a letter from a man she’s never met, a native o “ I wonder how the book got to Guernsey? Perhaps there is some sort of secret homing instinct in books that brings them to their perfect readers.” January 1946: London is emerging from the shadow of the Second World War, and writer Juliet Ashton is looking for her next book subject. Who could imagine that she would find it in a letter from a man she’s never met, a native of the island of Guernsey, who has come across her name written inside a book by Charles Lamb….As Juliet and her new correspondent exchange letters, Juliet is drawn into the world of this man and his friends—and what a wonderfully eccentric world it is. The Guernsey Literary and Potato Peel Pie Society—born as a spur-of-the-moment alibi when its members were discovered breaking curfew by the Germans occupying their island—boasts a charming, funny, deeply human cast of characters, from pig farmers to phrenologists, literature lovers all.Juliet begins a remarkable correspondence with the society’s members, learning about their island, their taste in books, and the impact the recent German occupation has had on their lives. Captivated by their stories, she sets sail for Guernsey, and what she finds will change her forever.Written with warmth and humor as a series of letters, this novel is a celebration of the written word in all its guises, and of finding connection in the most surprising ways. ...more",4a0a276409968a73,https://books.toscrape.com/catalogue/the-guernsey-literary-and-potato-peel-pie-society_253/index.html,https://books.toscrape.com/media/cache/98/e3/98e3925e5e6a66acf2cde918fc147205.jpg,True,303
Girl in the Blue Coat,Historical Fiction,46.83,In stock (3 available),3,2,"Amsterdam, 1943. Hanneke spends her days finding and delivering sought-after black market goods to paying customers, nights hiding the true nature of her work from her concerned parents, and every waking moment mourning her boyfriend, who was killed on the Dutch front lines when the German army invaded. Her illegal work keeps her family afloat, and Hanneke also likes to th Amsterdam, 1943. Hanneke spends her days finding and delivering sought-after black market goods to paying customers, nights hiding the true nature of her work from her concerned parents, and every waking moment mourning her boyfriend, who was killed on the Dutch front lines when the German army invaded. Her illegal work keeps her family afloat, and Hanneke also likes to think of it as a small act of rebellion against the Nazis.On a routine delivery, a client asks Hanneke for help. Expecting to hear that Mrs. Janssen wants meat or kerosene, Hanneke is shocked by the older woman’s frantic plea to find a person: a Jewish teenager Mrs. Janssen had been hiding, who has vanished without a trace from a secret room. Hanneke initially wants nothing to do with such a dangerous task but is ultimately drawn into a web of mysteries and stunning revelations—where the only way out is through.Beautifully written, intricately plotted, and meticulously researched, Girl in the Blue Coat is an extraordinary, unforgettable story of bravery, grief, and love in impossible times. ...more",41fc5dce044f16f5,https://books.toscrape.com/catalogue/girl-in-the-blue-coat_160/index.html,https://books.toscrape.com/media/cache/15/ea/15eaabd188af8916c4a37d135f7b8952.jpg,True,237
Between Shades of Gray,Historical Fiction,20.79,In stock (3 available),3,5,"Lina is just like any other fifteen-year-old Lithuanian girl in 1941. She paints, she draws, she gets crushes on boys. Until one night when Soviet officers barge into her home, tearing her family from the comfortable life they've known. Separated from her father, forced onto a crowded and dirty train car, Lina, her mother, and her young brother slowly make their way north, Lina is just like any other fifteen-year-old Lithuanian girl in 1941. She paints, she draws, she gets crushes on boys. Until one night when Soviet officers barge into her home, tearing her family from the comfortable life they've known. Separated from her father, forced onto a crowded and dirty train car, Lina, her mother, and her young brother slowly make their way north, crossing the Arctic Circle, to a work camp in the coldest reaches of Siberia. Here they are forced, under Stalin's orders, to dig for beets and fight for their lives under the cruelest of conditions. Lina finds solace in her art, meticulously--and at great risk--documenting events by drawing, hoping these messages will make their way to her father's prison camp to let him know they are still alive. It is a long and harrowing journey, spanning years and covering 6,500 miles, but it is through incredible strength, love, and hope that Lina ultimately survives. Between Shades of Gray is a novel that will steal your breath and capture your heart. ...more",155e42df837ee5ff,https://books.toscrape.com/catalogue/between-shades-of-gray_128/index.html,https://books.toscrape.com/media/cache/df/45/df45004c7a4c3940946ad09f85805565.jpg,True,237
While You Were Mine,Historical Fiction,41.32,In stock (1 available),1,5,"Everything she loved could so easily be lost.The end of World War II should have brought joy to Gwen Mullen. But on V-J Day, her worst fear is realized. As celebrating crowds gather in Times Square, a soldier appears on her doorstep to claim Mary, the baby abandoned to Gwen one year earlier. Suddenly Gwen is on the verge of losing the child she has nurtured and loves dearl Everything she loved could so easily be lost.The end of World War II should have brought joy to Gwen Mullen. But on V-J Day, her worst fear is realized. As celebrating crowds gather in Times Square, a soldier appears on her doorstep to claim Mary, the baby abandoned to Gwen one year earlier. Suddenly Gwen is on the verge of losing the child she has nurtured and loves dearly.With no legal claim to Mary, Gwen begins to teach Lieutenant John McKee how to care for his child, knowing that he will ultimately take Mary away. What starts as a contentious relationship, however, turns into something more, and Gwen must open her heart to learn that love means taking chances.While You Were Mine paints a vivid portrait of 1940s New York and tells an enchanting tale of the nature of love and trust. ...more",8ceb5c6aed2c5f8b,https://books.toscrape.com/catalogue/while-you-were-mine_97/index.html,https://books.toscrape.com/media/cache/4f/7c/4f7cde01c9711886ef5a8fa14996a52d.jpg,True,212
The Secret Healer,Historical Fiction,34.56,In stock (1 available),1,3,"In the fourteenth century, opportunities for women are limited to the home. But spirited young Madlen finds her calling as assistant to the city’s trusted midwife, Clara. Working alongside Clara, Madlen develops a surprisingly soothing technique and quickly becomes a talented healer.After Clara’s tragic death, Madlen alone rushes to assist the birth of a local nobleman’s c In the fourteenth century, opportunities for women are limited to the home. But spirited young Madlen finds her calling as assistant to the city’s trusted midwife, Clara. Working alongside Clara, Madlen develops a surprisingly soothing technique and quickly becomes a talented healer.After Clara’s tragic death, Madlen alone rushes to assist the birth of a local nobleman’s child. But rather than the joy of birth, Madlen walks into an accusation of murder and witchcraft because of her extraordinary gifts. Forced to flee her own town, she establishes a new identity in the home of her aunt. Yet even though it endangers her life, she cannot resist the urge to help the sick patients who seek out her miraculous treatment. When she meets handsome Johannes—an investigator hired by the Church to bring her to justice for sacrilegious acts—she becomes drawn to the very man who could destroy her.Will Madlen’s gifts bring about her downfall? Or can love and reason prevail in a time of fearful superstition? ...more",38f776ab9118aed7,https://books.toscrape.com/catalogue/the-secret-healer_80/index.html,https://books.toscrape.com/media/cache/3e/59/3e59b2225c72d3dcf40a306e2b983314.jpg,True,222
Starlark,Historical Fiction,25.83,In stock (1 available),1,3,"On the morning of her wedding, Roma awakens to find that a 21st century eclipse has swept her through time and space to medieval Ireland—a land bedevilled with strife, conflict and danger at every possible turn. Soon caught up in an intricate spider’s web of political intrigue, Roma is forced to ally herself and marry a man she passionately hates—a cocky, rugged, silver-to On the morning of her wedding, Roma awakens to find that a 21st century eclipse has swept her through time and space to medieval Ireland—a land bedevilled with strife, conflict and danger at every possible turn. Soon caught up in an intricate spider’s web of political intrigue, Roma is forced to ally herself and marry a man she passionately hates—a cocky, rugged, silver-tongued Irish warrior—and the only man who can protect her from the dark forces at work on the Emerald Isle… For under the rolling green hills of the ancient Irish countryside lies a powerful force that even today is only spoken of in hushed tones. And as the war deepens, Roma finds herself falling for the one man she swore that she never would—her husband, Fionn, whose fierce passion drives her crazy despite herself. Roma’s a very long way from home—but her battle has only just begun, and now she needs Fionn’s help more than ever to succeed…and craves his touch more than ever to survive. Rich in historical detail and breathtaking romance, prepare to be swept back in time to the lush mythology, epic legends, and Celtic magic of STARLARK’s medieval Ireland—and the spellbinding tale of a love so absolute it transcends time itself… ...more",e25164e5b3fe208b,https://books.toscrape.com/catalogue/starlark_56/index.html,https://books.toscrape.com/media/cache/76/e2/76e2881d47f2da9283e52d3c57eef532.jpg,True,271
Lost Among the Living,Historical Fiction,27.7,In stock (1 available),1,4,"England, 1921. Three years after her husband, Alex, disappeared, shot down over Germany, Jo Manders still mourns his loss. Working as a paid companion to Alex's wealthy, condescending aunt, Dottie Forsyth, Jo travels to the family’s estate in the Sussex countryside. But there is much she never knew about her husband’s origins…and the revelation of a mysterious death in the England, 1921. Three years after her husband, Alex, disappeared, shot down over Germany, Jo Manders still mourns his loss. Working as a paid companion to Alex's wealthy, condescending aunt, Dottie Forsyth, Jo travels to the family’s estate in the Sussex countryside. But there is much she never knew about her husband’s origins…and the revelation of a mysterious death in the Forsyths’ past is just the beginning…All is not well at Wych Elm House. Dottie's husband is distant, and her son was grievously injured in the war. Footsteps follow Jo down empty halls, and items in her bedroom are eerily rearranged. The locals say the family is cursed, and that a ghost in the woods has never rested. And when Jo discovers her husband’s darkest secrets, she wonders if she ever really knew him. Isolated in a place of deception and grief, she must find the truth or lose herself forever.And then a familiar stranger arrives at Wych Elm House… ...more",d510567580c8be52,https://books.toscrape.com/catalogue/lost-among-the-living_31/index.html,https://books.toscrape.com/media/cache/5f/03/5f0345cd81aaad65bb9f6a34ec0f6b9b.jpg,True,220
A Spy's Devotion (The Regency Spies of London #1),Historical Fiction,16.97,In stock (1 available),1,5,"In England’s Regency era, manners and elegance reign in public life—but behind closed doors treason and tawdriness thrive. Nicholas Langdon is no stranger to reserved civility or bloody barbarity. After suffering a battlefield injury, the wealthy, well-connected British officer returns home to heal—and to fulfill a dying soldier’s last wish by delivering his coded diary.At In England’s Regency era, manners and elegance reign in public life—but behind closed doors treason and tawdriness thrive. Nicholas Langdon is no stranger to reserved civility or bloody barbarity. After suffering a battlefield injury, the wealthy, well-connected British officer returns home to heal—and to fulfill a dying soldier’s last wish by delivering his coded diary.At the home of the Wilherns, one of England’s most powerful families, Langdon attends a lavish ball where he meets their beautiful and intelligent ward, Julia Grey. Determined to maintain propriety, he keeps his distance—until the diary is stolen and all clues lead to Julia’s guardian. As Langdon traces an evil plot that could be the nation’s undoing, he grows ever more intrigued by the lovely young woman. And when Julia realizes that England—and the man she is falling in love with—need her help, she finds herself caught in the fray. Will the two succumb to their attraction while fighting to save their country? ...more",19fec36a1dfb4c16,https://books.toscrape.com/catalogue/a-spys-devotion-the-regency-spies-of-london-1_3/index.html,https://books.toscrape.com/media/cache/f9/6b/f96b60a7614c4e3e868b82f6811efc7c.jpg,True,214
The Secret Garden,Classics,15.08,In stock (5 available),5,4,"When orphaned Mary Lennox comes to live at her uncle's great house on the Yorkshire Moors, she finds it full of secrets. The mansion has nearly one hundred rooms, and her uncle keeps himself locked up. And at night, she hears the sound of crying down one of the long corridors.The gardens surrounding the large property are Mary's only escape. Then, Mary discovers a secret g When orphaned Mary Lennox comes to live at her uncle's great house on the Yorkshire Moors, she finds it full of secrets. The mansion has nearly one hundred rooms, and her uncle keeps himself locked up. And at night, she hears the sound of crying down one of the long corridors.The gardens surrounding the large property are Mary's only escape. Then, Mary discovers a secret garden, surrounded by walls and locked with a missing key. One day, with the help of two unexpected companions, she discovers a way in. Is everything in the garden dead, or can Mary bring it back to life? ...more",abbb492978ff656d,https://books.toscrape.com/catalogue/the-secret-garden_413/index.html,https://books.toscrape.com/media/cache/f1/78/f17805e88aed31aae352ab250b2a379d.jpg,True,170
The Metamorphosis,Classics,28.58,In stock (5 available),5,1,"As Gregor Samsa awoke one morning from uneasy dreams he found himself transformed in his bed into a gigantic insect. He was laying on his hard, as it were armor-plated, back and when he lifted his head a little he could see his domelike brown belly divided into stiff arched segments on top of which the bed quilt could hardly keep in position and was about to slide off comp As Gregor Samsa awoke one morning from uneasy dreams he found himself transformed in his bed into a gigantic insect. He was laying on his hard, as it were armor-plated, back and when he lifted his head a little he could see his domelike brown belly divided into stiff arched segments on top of which the bed quilt could hardly keep in position and was about to slide off completely. His numerous legs, which were pitifully thin compared to the rest of his bulk, waved helplessly before his eyes."" With this startling, bizarre, yet surprisingly funny first opening, Kafka begins his masterpiece, The Metamorphosis. It is the story of a young man who, transformed overnight into a giant beetle-like insect, becomes an object of disgrace to his family, an outsider in his own home, a quintessentially alienated man. A harrowing -- though absurdly comic -- meditation on human feelings of inadequacy, guilt, and isolation, The Metamorphosis has taken its place as one of the most widely read and influential works of twentieth-century fiction. As W.H. Auden wrote, ""Kafka is important to us because his predicament is the predicament of modern man."" ...more",93379e3a2072a01b,https://books.toscrape.com/catalogue/the-metamorphosis_409/index.html,https://books.toscrape.com/media/cache/9b/33/9b33c3c40c8d27054a3edf96cbf6a2fb.jpg,True,262
The Pilgrim's Progress,Classics,50.26,In stock (4 available),4,2,"Often rated as important as the Bible as a Christian document, this famous story of man's progress through life in search of salvation remains one of the most entertaining allegories of faith ever written. Set against realistic backdrops of town and country, the powerful drama of the pilgrim's trials and temptations follows him in his harrowing journey to the Celestial Cit Often rated as important as the Bible as a Christian document, this famous story of man's progress through life in search of salvation remains one of the most entertaining allegories of faith ever written. Set against realistic backdrops of town and country, the powerful drama of the pilgrim's trials and temptations follows him in his harrowing journey to the Celestial City.Along a road filled with monsters and spiritual terrors, Christian confronts such emblematic characters as Worldly Wiseman, Giant Despair, Talkative, Ignorance, and the demons of the Valley of the Shadow of Death. But he is also joined by Hopeful and Faithful.An enormously influential 17th-century classic, universally known for its simplicity, vigor, and beauty of language, The Pilgrim's Progress remains one of the most widely read books in the English language. ...more",6053ddf69c967d5f,https://books.toscrape.com/catalogue/the-pilgrims-progress_353/index.html,https://books.toscrape.com/media/cache/91/2a/912acfe6ee354d9d9bf3c1fa517c4252.jpg,True,192
The Hound of the Baskervilles (Sherlock Holmes #5),Classics,14.82,In stock (4 available),4,2,"Holmes and Watson are faced with their most terrifying case yet. The legend of the devil-beast that haunts the moors around the Baskerville family's home warns the descendants of that ancient clan never to venture out in those dark hours when the power of evil is exalted. Now, the most recent Baskerville, Sir Charles, is dead and the footprints of a giant hound have been f Holmes and Watson are faced with their most terrifying case yet. The legend of the devil-beast that haunts the moors around the Baskerville family's home warns the descendants of that ancient clan never to venture out in those dark hours when the power of evil is exalted. Now, the most recent Baskerville, Sir Charles, is dead and the footprints of a giant hound have been found near his body. Will the new heir meet the same fate? ...more",6587f46697fc4443,https://books.toscrape.com/catalogue/the-hound-of-the-baskervilles-sherlock-holmes-5_348/index.html,https://books.toscrape.com/media/cache/9d/fe/9dfe2a73c6a1a1c09927c904de641ebf.jpg,True,144
Little Women (Little Women #1),Classics,28.07,In stock (4 available),4,4,"Little Women is the heartwarming story of the March family that has thrilled generations of readers. It is the story of four sisters--Jo, Meg, Amy and Beth-- and of the courage, humor and ingenuity they display to survive poverty and the absence of their father during the Civil War.",deda806b68b0aa11,https://books.toscrape.com/catalogue/little-women-little-women-1_331/index.html,https://books.toscrape.com/media/cache/55/a9/55a942b0c092c40bdbb6a1f1be340984.jpg,True,49
